{
  "antiCheat": "none",
  "executableNames": ["grim dawn.exe"],
  "id": "indie.steam.219990.grim-dawn",
  "knownIssues": [
    "Grim Dawn 1.3 的新版 HUD 在部分转译后端会漏绘；Indie 会备份设置并自动启用兼容性更好的经典 HUD。",
    "DXMT 0.80 在 Grim Dawn 的显示设备枚举阶段可能崩溃，因此优先使用 D3DMetal 4。"
  ],
  "name": "Grim Dawn",
  "profiles": [
    {
      "arguments": [],
      "dllOverrides": {
        "d3d10": "n,b",
        "d3d10core": "b",
        "d3d11": "n,b",
        "d3d12": "n,b",
        "dxgi": "n,b"
      },
      "environment": {},
      "highResolution": true,
      "metalFX": false,
      "renderer": "d3dmetal",
      "steamLaunchOption": 1,
      "syncBackend": "msync"
    },
    {
      "arguments": [],
      "dllOverrides": {
        "d3d10core": "b",
        "d3d11": "b",
        "dxgi": "b"
      },
      "environment": {},
      "highResolution": true,
      "renderer": "dxmt",
      "syncBackend": "msync"
    },
    {
      "arguments": [],
      "dllOverrides": {
        "d3d10": "b",
        "d3d10core": "b",
        "d3d11": "b",
        "d3d12": "b",
        "dxgi": "b"
      },
      "environment": {
        "CX_ACTIVE_GRAPHICS_BACKEND": "wined3d"
      },
      "highResolution": true,
      "renderer": "wined3d",
      "syncBackend": "msync"
    }
  ],
  "provenance": [],
  "schemaVersion": 1,
  "steamAppIDs": [219990]
}
